candidate_id,item_id,meeting_id,location_id,candidate_name,candidate_address,candidate_source,arcgis_query,evidence,review_status
95,726,135,17,US 41 / Tamiami Trail,"US 41, Estero, FL",known_location_missing_coordinates,"US 41, Estero, FL","Approved second reading and adopt Ordinance No. 2017-02 Approving Zoning and DRI Development Order Amendments for the Coconut Point Mixed Use Planned Development and Development of Regional Impact for Property Bounded by US 41 on the West, Williams Road on the North, Seminole Gulf Railroad Right-of-Way on the East and the Southern Boundary for the Village of Estero Limits, subject to all conditions and revisions, as stated in the ordinance. The conditions and deviations include, but are not limi",Needs Geocode
96,726,135,23,Coconut Point,"Coconut Point, Estero, FL",known_location_missing_coordinates,"Coconut Point, Estero, FL","Approved second reading and adopt Ordinance No. 2017-02 Approving Zoning and DRI Development Order Amendments for the Coconut Point Mixed Use Planned Development and Development of Regional Impact for Property Bounded by US 41 on the West, Williams Road on the North, Seminole Gulf Railroad Right-of-Way on the East and the Southern Boundary for the Village of Estero Limits, subject to all conditions and revisions, as stated in the ordinance. The conditions and deviations include, but are not limi",Needs Geocode
97,741,137,11,Broadway Avenue West UEP,"Broadway Avenue West, Estero, FL",known_location_missing_coordinates,"Broadway Avenue West, Estero, FL","Adopted Resolution No. 2017-23 Authorizing the Waiving of Competitive Bidding Procedures and Authorizing the Village Manager to Execute a Contract for Emergency Replacement of the Culvert, Abutments, and Related Ditching for the Stonnwater Conveyance System under Broadway Avenue West, near US 41, with a Contractor Chosen by Village Staff; and Providing an Effective Date",Needs Geocode
98,741,137,17,US 41 / Tamiami Trail,"US 41, Estero, FL",known_location_missing_coordinates,"US 41, Estero, FL","Adopted Resolution No. 2017-23 Authorizing the Waiving of Competitive Bidding Procedures and Authorizing the Village Manager to Execute a Contract for Emergency Replacement of the Culvert, Abutments, and Related Ditching for the Stonnwater Conveyance System under Broadway Avenue West, near US 41, with a Contractor Chosen by Village Staff; and Providing an Effective Date",Needs Geocode
99,741,137,19,Broadway Avenue,"Broadway Avenue, Estero, FL",known_location_missing_coordinates,"Broadway Avenue, Estero, FL","Adopted Resolution No. 2017-23 Authorizing the Waiving of Competitive Bidding Procedures and Authorizing the Village Manager to Execute a Contract for Emergency Replacement of the Culvert, Abutments, and Related Ditching for the Stonnwater Conveyance System under Broadway Avenue West, near US 41, with a Contractor Chosen by Village Staff; and Providing an Effective Date",Needs Geocode
100,755,139,33,Genova,"Genova, Estero, FL",known_location_missing_coordinates,"Genova, Estero, FL",Adopted Resolution No. 2016-22 approving the vacation of an easement and right-of-way for the Genova project,Needs Geocode
101,766,141,14,Estero Parkway,"Estero Parkway, Estero, FL",known_location_missing_coordinates,"Estero Parkway, Estero, FL","Approved the Interlocal Agreement with Lee County for the continuation of the University Landscaping Operation and Maintenance Special Improvement Unit to provide an enhanced level oflandscaping along certain portions of Corkscrew Road, Estero Parkway and Ben Hill Griffin Parkway within the Village limits and to schedule first reading of the ordinance for September 7, 2016 and second reading and public hearing for September 21, 2016",Needs Geocode
102,766,141,15,Ben Hill Griffin Parkway,"Ben Hill Griffin Parkway, Estero, FL",known_location_missing_coordinates,"Ben Hill Griffin Parkway, Estero, FL","Approved the Interlocal Agreement with Lee County for the continuation of the University Landscaping Operation and Maintenance Special Improvement Unit to provide an enhanced level oflandscaping along certain portions of Corkscrew Road, Estero Parkway and Ben Hill Griffin Parkway within the Village limits and to schedule first reading of the ordinance for September 7, 2016 and second reading and public hearing for September 21, 2016",Needs Geocode
103,767,142,17,US 41 / Tamiami Trail,"US 41, Estero, FL",known_location_missing_coordinates,"US 41, Estero, FL","approved by the ECCL members present at the August 28, 2015 meeting related to including a list of civic, recreational and arts, and entertainment assets in the section of the Village Center south of Corkscrew Road and. expanded public, bike, and pedestrian access to the Estero River, improved integration of the Koreshan State Site and the Boomer/future State park property with the historic and river access properties in the Old Estero area north of the Estero River into an expanded Village Cent",Needs Geocode
104,767,142,22,Estero River,"Estero River, Estero, FL",known_location_missing_coordinates,"Estero River, Estero, FL","approved by the ECCL members present at the August 28, 2015 meeting related to including a list of civic, recreational and arts, and entertainment assets in the section of the Village Center south of Corkscrew Road and. expanded public, bike, and pedestrian access to the Estero River, improved integration of the Koreshan State Site and the Boomer/future State park property with the historic and river access properties in the Old Estero area north of the Estero River into an expanded Village Cent",Needs Geocode
105,767,142,25,Koreshan State Park,"Koreshan State Park, Estero, FL",known_location_missing_coordinates,"Koreshan State Park, Estero, FL","approved by the ECCL members present at the August 28, 2015 meeting related to including a list of civic, recreational and arts, and entertainment assets in the section of the Village Center south of Corkscrew Road and. expanded public, bike, and pedestrian access to the Estero River, improved integration of the Koreshan State Site and the Boomer/future State park property with the historic and river access properties in the Old Estero area north of the Estero River into an expanded Village Cent",Needs Geocode
106,767,142,30,The Brooks,"The Brooks, Estero, FL",known_location_missing_coordinates,"The Brooks, Estero, FL","approved by the ECCL members present at the August 28, 2015 meeting related to including a list of civic, recreational and arts, and entertainment assets in the section of the Village Center south of Corkscrew Road and. expanded public, bike, and pedestrian access to the Estero River, improved integration of the Koreshan State Site and the Boomer/future State park property with the historic and river access properties in the Old Estero area north of the Estero River into an expanded Village Cent",Needs Geocode
107,773,143,3,Estero Fire Rescue,"21500 Three Oaks Parkway, Estero, FL 33928",known_location_missing_coordinates,"21500 Three Oaks Parkway, Estero, FL 33928",Approved the Interlocal Agreement with Estero Fire Rescue for fire services,Needs Geocode
108,792,145,13,Williams Road,"Williams Road, Estero, FL",known_location_missing_coordinates,"Williams Road, Estero, FL","Approved award of Contract EC 2023-50 to Kisinger Campo & Associates (KCA) for Williams Road Widening Preliminary Engineering and Design services for $577,133, approve a $57,700 contingency for additional services that may be required to complete the project, and authorize the Village Manager to sign the contract and other additional implementing documents within the scope of the contract on behalf of the Village of Estero Council",Needs Geocode
109,793,145,17,US 41 / Tamiami Trail,"US 41, Estero, FL",known_location_missing_coordinates,"US 41, Estero, FL","Approved award Misc. Contractor Services contract EC 2019-66 STA 40 with P & T Lawn & Tractor Services for $254,934 to install new landscaping within US 41 Medians 6-12, approve a contingency fund amount of $25,500 (an amount equal to 10% of the total project cost) to cover unforeseen circumstances which may occur, and authorize the Village Manager to execute the contract documents on behalf of the Village of Estero Council",Needs Geocode
110,794,145,16,Three Oaks Parkway,"Three Oaks Parkway, Estero, FL",known_location_missing_coordinates,"Three Oaks Parkway, Estero, FL","Approved award EC 2019-66 Supplemental Task Authorization (STA)- 41 for the engagement of a Contractor to construct and install a monument sign on Three Oaks Parkway at a total cost of $74,449, approve a contingency fund amount of $7,500 (an amount equal to 10% of the total project cost) to cover unforeseen circumstances which may occur, and authorize the Village Manager to execute the STA on behalf of the Village of Estero Council",Needs Geocode
111,800,146,44,645 feet south of Salerno Bay Road,"645 feet south of Salerno Bay Road, Estero, FL",address_regex,"645 feet south of Salerno Bay Road, Estero, FL","Approved Supplemental Task Authorization (STA)-28 under RFQ 2019- 03 Miscellaneous Contractor Services to P & T Lawn and Tractor Service, Inc. for the engagement of a Contractor to construct and install a monument sign on Imperial Parkway (in the roadway median at the Village's southern limits approximately 645 feet south of Salerno Bay Road) at a total cost of $58,941.50, approve a contingency fund amount of $5,890 (an amount equal to 10% of the total project cost) to cover unforeseen circumsta",Needs Geocode
112,807,147,22,Estero River,"Estero River, Estero, FL",known_location_missing_coordinates,"Estero River, Estero, FL","Adopted Resolution No. 2020-16 with the addition of budgeting an additional $35,000 for extra marine patrol on the Estero River and $10,000 to upgrade the audio equipment Village Council Chambers",Needs Geocode
113,809,147,14,Estero Parkway,"Estero Parkway, Estero, FL",known_location_missing_coordinates,"Estero Parkway, Estero, FL",Approved Change Order one to Contract No. EC 2018-50-STA3 for CEI services for Estero Parkway Roadway and Landscape Improvement Project. Authorize the Village Manager to execute the amendment and any other ancillary documents on behalf of the Council,Needs Geocode
114,818,148,20,River Ranch Road,"River Ranch Road, Estero, FL",known_location_missing_coordinates,"River Ranch Road, Estero, FL","Approved executing the attached contract with CW3 Engineering to provide River Ranch Road Improvement Design and Permitting services for a not to exceed contract amount of $552,245.00, approve a contingency fund amount of $55,200 (an amount equal to 10% of the total project cost) to cover unforeseen circumstances which may occur, and Authorize the Village Manager to execute the with CW3 Engineering and any other related ancillary documents on behalf of the Village Council",Needs Geocode
115,819,148,20,River Ranch Road,"River Ranch Road, Estero, FL",known_location_missing_coordinates,"River Ranch Road, Estero, FL","Approved executing the attached contract with HighSpans to provide River Ranch Road Improvement project management services for a not to exceed contract amount of Village Council Minutes - Thursday, September 09, 2021 5 $52,548.00, approve a contingency fund amount of $5,300 (an amount equal to 10% of the total project cost) to cover unforeseen circumstances which may occur, and authorize the Village Manager to execute the contract with HighSpans and any other related ancillary documents on beha",Needs Geocode
116,820,148,13,Williams Road,"Williams Road, Estero, FL",known_location_missing_coordinates,"Williams Road, Estero, FL","Approved executing the attached contract with HighSpans to provide Williams Road Bike-Ped Improvements project management services for a not to exceed contract amount of $41,934.00, approve a contingency fund amount of $4,200 (an amount equal to 10% of the total project cost) to cover unforeseen circumstances which may occur, and authorize the Village Manager to execute the contract with HighSpans and any other related ancillary documents on behalf of the Village Council",Needs Geocode
117,863,155,14,Estero Parkway,"Estero Parkway, Estero, FL",known_location_missing_coordinates,"Estero Parkway, Estero, FL","(1) Concurred with the ranking of consultants for CN 2017-01 Estero Parkway Roadway/ Landscape Design & Estero Roadways Landscape Master Plan as follows: Number 1 - Agnoli, Barber & Brundage; Number 2 - Kimley-Hom; Number 3 -T.Y. Lin; Number 4-DRMP; (2) Authorized staff to negotiate a contract with the Number 1 ranked firm, Agnoli, Barber & Brundage to provide professional consulting services for the roadway/landscape design for improvements to Estero Parkway",Needs Geocode
118,894,158,16,Three Oaks Parkway,"Three Oaks Parkway, Estero, FL",known_location_missing_coordinates,"Three Oaks Parkway, Estero, FL","Approved a contract, via a piggybacking of the School District's bid, with Harvard Jolly Architecture in the amount of $98,000 to provide architectural and engineering services for additional athletic facilities at the proposed new School District of Lee County PreK-8 School on Three Oaks Parkway, approve a contingency fund amount of $9,800 (an amount equal to 10% of the total project cost) to cover unforeseen circumstances which may occur, and authorize the Village Manager to execute the contra",Needs Geocode
119,905,160,3,Estero Fire Rescue,"21500 Three Oaks Parkway, Estero, FL 33928",known_location_missing_coordinates,"21500 Three Oaks Parkway, Estero, FL 33928","approved as presented: October 7, 2015 VILLAGE COUNCIL WORKSHOP OF SEPTEMBER 23, 2015 The Village of Estero Council Workshop was held on this date at the Estero Fire Rescue District Meeting Room, 21500 Three Oaks Parkway, Estero, Florida. Present: Mayor Nick Batos - District 6, Vice-Mayor Howard Levitan - District 2, Councilmember Bill Ribble, District 1, Councilmember Donald Brown - District 3, Councilmember Katy Errington - District 4, Councilmember Jim Boesch - District 5, and Councilmember J",Needs Geocode
120,905,160,16,Three Oaks Parkway,"Three Oaks Parkway, Estero, FL",known_location_missing_coordinates,"Three Oaks Parkway, Estero, FL","approved as presented: October 7, 2015 VILLAGE COUNCIL WORKSHOP OF SEPTEMBER 23, 2015 The Village of Estero Council Workshop was held on this date at the Estero Fire Rescue District Meeting Room, 21500 Three Oaks Parkway, Estero, Florida. Present: Mayor Nick Batos - District 6, Vice-Mayor Howard Levitan - District 2, Councilmember Bill Ribble, District 1, Councilmember Donald Brown - District 3, Councilmember Katy Errington - District 4, Councilmember Jim Boesch - District 5, and Councilmember J",Needs Geocode
121,905,160,30,The Brooks,"The Brooks, Estero, FL",known_location_missing_coordinates,"The Brooks, Estero, FL","approved as presented: October 7, 2015 VILLAGE COUNCIL WORKSHOP OF SEPTEMBER 23, 2015 The Village of Estero Council Workshop was held on this date at the Estero Fire Rescue District Meeting Room, 21500 Three Oaks Parkway, Estero, Florida. Present: Mayor Nick Batos - District 6, Vice-Mayor Howard Levitan - District 2, Councilmember Bill Ribble, District 1, Councilmember Donald Brown - District 3, Councilmember Katy Errington - District 4, Councilmember Jim Boesch - District 5, and Councilmember J",Needs Geocode
122,905,160,37,21500 Three Oaks Parkway,"21500 Three Oaks Parkway, Estero, FL",address_regex,"21500 Three Oaks Parkway, Estero, FL","approved as presented: October 7, 2015 VILLAGE COUNCIL WORKSHOP OF SEPTEMBER 23, 2015 The Village of Estero Council Workshop was held on this date at the Estero Fire Rescue District Meeting Room, 21500 Three Oaks Parkway, Estero, Florida. Present: Mayor Nick Batos - District 6, Vice-Mayor Howard Levitan - District 2, Councilmember Bill Ribble, District 1, Councilmember Donald Brown - District 3, Councilmember Katy Errington - District 4, Councilmember Jim Boesch - District 5, and Councilmember J",Needs Geocode
123,924,164,19,Broadway Avenue,"Broadway Avenue, Estero, FL",known_location_missing_coordinates,"Broadway Avenue, Estero, FL","Approved the Florida DEP Standard Grant Agreement for the Estero Broadway Avenue East Phase 1 project (Agreement Number L0187), and to authorize the Village Manager or designee to execute all related documents",Needs Geocode
124,954,168,45,20275 Sherrill Ln,"20275 Sherrill Ln, Estero, FL",address_regex,"20275 Sherrill Ln, Estero, FL","Approved staff recommendation accepting the request of Troy Blasko, the new owner to release the Village's code enforcement lien against 20275 Sherrill Ln, Estero in exchange for the payment of $5000.00",Needs Geocode
125,955,168,22,Estero River,"Estero River, Estero, FL",known_location_missing_coordinates,"Estero River, Estero, FL","Approved Change Order No. 1 to Contract EC 2022-39 STA 02 with J.R. Evans Engineering, P.A. for the Estero River North Branch Drainage HMGP Assistance project and authorize the Village Manager to sign Change Order No. 1 to Contract EC 2022-39 STA 02 with J.R. Evans Engineering, P.A",Needs Geocode
126,972,173,13,Williams Road,"Williams Road, Estero, FL",known_location_missing_coordinates,"Williams Road, Estero, FL","Approved Village Staff and the Villages Lobbyists to request state funding for the following projects and funding amounts Sunny Goves Utility Extension Project - $800,000 Estero SportsPark Reuse Water Main Extension and Storage Tank - $800,000 Estero Parkway Reuse Water Main Extension - $800,000 Williams Road and Atlantic Gulf Drive Improvements - $800,000",Needs Geocode
127,972,173,14,Estero Parkway,"Estero Parkway, Estero, FL",known_location_missing_coordinates,"Estero Parkway, Estero, FL","Approved Village Staff and the Villages Lobbyists to request state funding for the following projects and funding amounts Sunny Goves Utility Extension Project - $800,000 Estero SportsPark Reuse Water Main Extension and Storage Tank - $800,000 Estero Parkway Reuse Water Main Extension - $800,000 Williams Road and Atlantic Gulf Drive Improvements - $800,000",Needs Geocode
128,989,176,43,8801 Corkscrew Road,"8801 Corkscrew Road, Estero, FL",address_regex,"8801 Corkscrew Road, Estero, FL","Approved award of Request for Bids No. RFB 2023-04, 8801 Corkscrew Road Structure Demolition to Southwest Builders Inc. to demolish the structure located at 8801 Corkscrew Road at a grand total cost of $106,890, approve a contingency fund amount of $10,689 (an amount equal to 10% of the total project cost) to cover unforeseen circumstances which may occur, and authorize the Village Manager to execute the contract documents on behalf of the Village of Estero Council",Needs Geocode
129,990,176,11,Broadway Avenue West UEP,"Broadway Avenue West, Estero, FL",known_location_missing_coordinates,"Broadway Avenue West, Estero, FL",Approved the Fiscal Year 2024-2025 Village of Estero legislative priorities to include. 1. Highlands Ave. Septic-to-Sewer 2. Sunny Groves UEP 3. Estero Bay Village UEP 4. Cypress Bend UEP 5. Broadway Ave. West Improvements 6. River Oaks Preserve,Needs Geocode
130,990,176,21,River Oaks Preserve,"River Oaks Preserve, Estero, FL",known_location_missing_coordinates,"River Oaks Preserve, Estero, FL",Approved the Fiscal Year 2024-2025 Village of Estero legislative priorities to include. 1. Highlands Ave. Septic-to-Sewer 2. Sunny Groves UEP 3. Estero Bay Village UEP 4. Cypress Bend UEP 5. Broadway Ave. West Improvements 6. River Oaks Preserve,Needs Geocode
131,1036,186,17,US 41 / Tamiami Trail,"US 41, Estero, FL",known_location_missing_coordinates,"US 41, Estero, FL","Approved EC 2019-66 Supplemental Task Authorization (STA) - 42 for the engagement of P&T Lawn and Tractor to construct and install a monument sign on US 41 at a total cost of $66,675, approve a contingency fund amount of $6,700 (an amount equal to 10% of the total project cost) to cover unforeseen circumstances which may occur, and authorize the Village Manager to execute the STA on behalf of the Village of Estero Council",Needs Geocode
132,1039,187,18,Coconut Road,"Coconut Road, Estero, FL",known_location_missing_coordinates,"Coconut Road, Estero, FL","Approved the agenda as amended: changing agenda item 5 from Public Hearings to the topic of Coconut Road, renumbering agenda items 8 through 12, moving Workshop Items after Village Manager's Report",Needs Geocode
133,1060,189,13,Williams Road,"Williams Road, Estero, FL",known_location_missing_coordinates,"Williams Road, Estero, FL","Approved the award of Request for Bids No. RFB 2021-03, Via Coconut Point & Williams Road Roundabout Landscaping & Irrigation for the Village of Estero to O'Donnell Landscapes, Inc. to provide landscaping and irrigation work at a cost of $120,181, approve a contingency fund amount of $12,000 (an amount equal to 10% of the total project cost) to cover unforeseen circumstances which may occur, authorize the Village Manager to execute the contract documents on behalf of the Village of Estero Counci",Needs Geocode
134,1060,189,23,Coconut Point,"Coconut Point, Estero, FL",known_location_missing_coordinates,"Coconut Point, Estero, FL","Approved the award of Request for Bids No. RFB 2021-03, Via Coconut Point & Williams Road Roundabout Landscaping & Irrigation for the Village of Estero to O'Donnell Landscapes, Inc. to provide landscaping and irrigation work at a cost of $120,181, approve a contingency fund amount of $12,000 (an amount equal to 10% of the total project cost) to cover unforeseen circumstances which may occur, authorize the Village Manager to execute the contract documents on behalf of the Village of Estero Counci",Needs Geocode
135,1072,191,13,Williams Road,"Williams Road, Estero, FL",known_location_missing_coordinates,"Williams Road, Estero, FL","Approved the purchase of 0.14 State Freshwater Herbaceous Mitigation Credits in the amount of $16,800 from the Big Cypress Mitigation Bank (the ""Bank"") for the Williams Rd./Atlantic Gulf Blvd. intersection improvement project and authorize the Village Manager to sign the Mitigation Credit Supply Agreement with the Big Cypress Mitigation Bank and other additional implementing documents on behalf of the Village of Estero Council",Needs Geocode
136,1079,192,16,Three Oaks Parkway,"Three Oaks Parkway, Estero, FL",known_location_missing_coordinates,"Three Oaks Parkway, Estero, FL","Approved the Interlocal Agreement with The Brooks Community Development District (CDD) for improvements to the Three Oaks Parkway paths and authorize the Village Manager to execute the agreement and any related documents or amendments as may be necessary which do not increase cost above $380,000",Needs Geocode
137,1079,192,30,The Brooks,"The Brooks, Estero, FL",known_location_missing_coordinates,"The Brooks, Estero, FL","Approved the Interlocal Agreement with The Brooks Community Development District (CDD) for improvements to the Three Oaks Parkway paths and authorize the Village Manager to execute the agreement and any related documents or amendments as may be necessary which do not increase cost above $380,000",Needs Geocode
138,1082,192,13,Williams Road,"Williams Road, Estero, FL",known_location_missing_coordinates,"Williams Road, Estero, FL","Approved EC 2024-06 STA -07 in the amount of $97,500 for Florida Acquisition & Appraisal Inc. to provide acquisition services for the Williams Road ditch, approve a $9,750 contingency for additional services that may be required to complete the project, and authorize the Village Manager to sign the contract and other additional implementing documents within the scope of the contract on behalf of the Village of Estero Council, and to approve and execute any subsequent amendments which do not requ",Needs Geocode
139,1089,194,3,Estero Fire Rescue,"21500 Three Oaks Parkway, Estero, FL 33928",known_location_missing_coordinates,"21500 Three Oaks Parkway, Estero, FL 33928","approved as presented: December 16, 2015 Village Council Special Meeting Minutes - November 13, 2015 Nicholas Batos Mayor Page 3 of3 VILLAGE COUNCIL WORKSHOP OF NOVEMER 13, 2015 The Village of Estero Council Workshop was held on this date at the Estero Fire Rescue District Meeting Room, 21500 Three Oaks Parkway, Estero, Florida. Present: Mayor Nick Batos - District 6, Vice-Mayor Howard Levitan - District 2, Councilmember Bill Ribble, District 1, Councilmember Donald Brown - District 3, Councilme",Needs Geocode
140,1089,194,16,Three Oaks Parkway,"Three Oaks Parkway, Estero, FL",known_location_missing_coordinates,"Three Oaks Parkway, Estero, FL","approved as presented: December 16, 2015 Village Council Special Meeting Minutes - November 13, 2015 Nicholas Batos Mayor Page 3 of3 VILLAGE COUNCIL WORKSHOP OF NOVEMER 13, 2015 The Village of Estero Council Workshop was held on this date at the Estero Fire Rescue District Meeting Room, 21500 Three Oaks Parkway, Estero, Florida. Present: Mayor Nick Batos - District 6, Vice-Mayor Howard Levitan - District 2, Councilmember Bill Ribble, District 1, Councilmember Donald Brown - District 3, Councilme",Needs Geocode
141,1089,194,37,21500 Three Oaks Parkway,"21500 Three Oaks Parkway, Estero, FL",address_regex,"21500 Three Oaks Parkway, Estero, FL","approved as presented: December 16, 2015 Village Council Special Meeting Minutes - November 13, 2015 Nicholas Batos Mayor Page 3 of3 VILLAGE COUNCIL WORKSHOP OF NOVEMER 13, 2015 The Village of Estero Council Workshop was held on this date at the Estero Fire Rescue District Meeting Room, 21500 Three Oaks Parkway, Estero, Florida. Present: Mayor Nick Batos - District 6, Vice-Mayor Howard Levitan - District 2, Councilmember Bill Ribble, District 1, Councilmember Donald Brown - District 3, Councilme",Needs Geocode
